{
  "format": "org.fpv.race-event.snapshot",
  "version": 1,
  "snapshotId": "forest-finale-session-1:88",
  "eventSessionId": "forest-finale-session-1",
  "capturedAt": "2026-09-06T13:15:00.000Z",
  "event": { "id": "forest-finale", "name": "Forest Race Finale", "organizer": "Rotormaniacs", "sourceUrl": "https://rotormaniacs.livefpv.com/live/scoring/" },
  "sources": [
    { "id": "livefpv-scoring", "provider": "LiveFPV", "kind": "livefpv-scoring", "revision": "livefpv-rev-240", "capturedAt": "2026-09-06T13:15:00.000Z", "confidence": "high" }
  ],
  "schedule": { "currentRaceId": "heat-18", "currentIndex": 0, "nextRaceIds": ["heat-19"], "afterNextRaceIds": [] },
  "races": [
    {
      "id": "heat-18",
      "runId": "heat-18-run-2",
      "attempt": 2,
      "order": 17,
      "label": "Qualifier (Heat 18/24) — Rerun",
      "phase": "Qualifier",
      "round": "Qualifier Round 3",
      "heat": { "number": 18, "count": 24 },
      "status": "staging",
      "links": {},
      "pilots": [
        { "id": "pilot-one", "callsign": "PilotOne", "slot": 1, "video": { "channel": "R1", "frequencyMHz": 5658 } },
        { "id": "pilot-two", "callsign": "PilotTwo", "slot": 2, "video": { "channel": "R8", "frequencyMHz": 5917 } }
      ]
    }
  ],
  "quality": {
    "state": "fresh",
    "warnings": [
      { "code": "race.rerun", "message": "Heat 18 was reopened by the source as run 2.", "severity": "info" }
    ],
    "domains": {
      "schedule": { "state": "fresh", "capturedAt": "2026-09-06T13:15:00.000Z", "sourceIds": ["livefpv-scoring"] },
      "lineup": { "state": "fresh", "capturedAt": "2026-09-06T13:15:00.000Z", "sourceIds": ["livefpv-scoring"] },
      "timing": { "state": "fresh", "capturedAt": "2026-09-06T13:15:00.000Z", "sourceIds": ["livefpv-scoring"] },
      "channels": { "state": "fresh", "capturedAt": "2026-09-06T13:15:00.000Z", "sourceIds": ["livefpv-scoring"] }
    }
  },
  "activeAnnouncements": []
}
